{"case_id":"case-06","idempotency_key":"certify:sha256:a83a38024ac2981a7306f6093c73db6ff07e7390fe0172f0b9466e33cbdd0cb7","operation_id":"certify:sha256:a83a38024ac2981a7306f6093c73db6ff07e7390fe0172f0b9466e33cbdd0cb7","receipt":{"artifact_refs":[],"authority_head_digest":"d0a2d9e7f368829c9661b4adf20074ed9f5ff12d267800540a20e9071d92186f","bundle_digest":"e20e8594919a1ce528b96ed3d5890bf1e50a4ace3530be20f052bf6facb26933","context_digest":"sha256:4f087c2527967c2b1128473133adcd3b58e1903e1795db4f27cf6ed18e85a8bb","evidence_refs":[],"fence_epoch":1,"idempotency_key":"certify:sha256:a83a38024ac2981a7306f6093c73db6ff07e7390fe0172f0b9466e33cbdd0cb7","mapping_confirmation_receipt_digest":"sha256:fb9397a7fa832ae48d4e56150cd957c155110fe4cf1da857300421b959ad65db","provider_fence_digest":"74ef91f020701448014d25d873abe48128e772095c285be7fac5bf89eeb6025b","provider_id":"ros2-readonly","provider_operation":"odom.sample","provider_started_at":"2026-09-08T16:11:26.349478Z","release_digest":"sha256:835dd954cfeb3ca311dfa23c2ea18c4472067c640374daf3d5b9d7539d62f554","request_digest":"3318afb7632687b11d04d6a337092ac8143ed7d20c3661979cfee8f36cd1d057","result":{"byte_count":1248,"sha256":"sha256:c8b25517cf8b3d36c0cb0c093d2f6b0ab1d3e8f11c6dc2003bb47d5cce30e955","status":"SUCCEEDED"},"schema_version":"rolo-targetd-call-receipt/v2","session_id":"n7-r0-20260908T161029Z-7cda2170","status":"SUCCEEDED","target_id":"mentorpi","updated_at":"2026-09-08T16:11:32.357469Z"},"run_id":"n6-formal-r0-20260908T161029Z-48905bd7","schema_version":"rolo-certify-targetd-call-receipt-sidecar/v1","session_id":"n7-r0-20260908T161029Z-7cda2170","suite_digest":"6835c1603dd1397f779916b97c5cb8e3389c7f3f92adbd5422b7b553f0e8da24","suite_id":"landerpi-odom-formal-r0-10"}
