{"case_id":"case-04","idempotency_key":"certify:sha256:8f3d2adc3700c8cf756f0214b79482a9839002f5ea16d8cd85b6a361f62d4421","operation_id":"certify:sha256:8f3d2adc3700c8cf756f0214b79482a9839002f5ea16d8cd85b6a361f62d4421","receipt":{"artifact_refs":[],"authority_head_digest":"d0a2d9e7f368829c9661b4adf20074ed9f5ff12d267800540a20e9071d92186f","bundle_digest":"e20e8594919a1ce528b96ed3d5890bf1e50a4ace3530be20f052bf6facb26933","context_digest":"sha256:4f087c2527967c2b1128473133adcd3b58e1903e1795db4f27cf6ed18e85a8bb","evidence_refs":[],"fence_epoch":1,"idempotency_key":"certify:sha256:8f3d2adc3700c8cf756f0214b79482a9839002f5ea16d8cd85b6a361f62d4421","mapping_confirmation_receipt_digest":"sha256:fb9397a7fa832ae48d4e56150cd957c155110fe4cf1da857300421b959ad65db","provider_fence_digest":"c940ad154850dfef3c617b87766834992c33935319058751b3e26c3c1d9b5967","provider_id":"ros2-readonly","provider_operation":"odom.sample","provider_started_at":"2026-09-08T16:11:13.641122Z","release_digest":"sha256:835dd954cfeb3ca311dfa23c2ea18c4472067c640374daf3d5b9d7539d62f554","request_digest":"c8fe9c6ea1154691e3cbc35d5b158d0fb2d71f86927aa93ddb41e4dd9e23b01e","result":{"byte_count":1249,"sha256":"sha256:03f8d98ad8fb21a37c9299803c0a692e5b7edae4adf745e38b428b46fdc98b07","status":"SUCCEEDED"},"schema_version":"rolo-targetd-call-receipt/v2","session_id":"n7-r0-20260908T161029Z-7cda2170","status":"SUCCEEDED","target_id":"mentorpi","updated_at":"2026-09-08T16:11:19.909036Z"},"run_id":"n6-formal-r0-20260908T161029Z-48905bd7","schema_version":"rolo-certify-targetd-call-receipt-sidecar/v1","session_id":"n7-r0-20260908T161029Z-7cda2170","suite_digest":"6835c1603dd1397f779916b97c5cb8e3389c7f3f92adbd5422b7b553f0e8da24","suite_id":"landerpi-odom-formal-r0-10"}
