{"case_id":"case-07","idempotency_key":"certify:sha256:2c8775d17858ac10743afa748094d34967406ed502b1c9f0f6aadf32b0cfba72","operation_id":"certify:sha256:2c8775d17858ac10743afa748094d34967406ed502b1c9f0f6aadf32b0cfba72","receipt":{"artifact_refs":[],"authority_head_digest":"d0a2d9e7f368829c9661b4adf20074ed9f5ff12d267800540a20e9071d92186f","bundle_digest":"e20e8594919a1ce528b96ed3d5890bf1e50a4ace3530be20f052bf6facb26933","context_digest":"sha256:4f087c2527967c2b1128473133adcd3b58e1903e1795db4f27cf6ed18e85a8bb","evidence_refs":[],"fence_epoch":1,"idempotency_key":"certify:sha256:2c8775d17858ac10743afa748094d34967406ed502b1c9f0f6aadf32b0cfba72","mapping_confirmation_receipt_digest":"sha256:fb9397a7fa832ae48d4e56150cd957c155110fe4cf1da857300421b959ad65db","provider_fence_digest":"4a5e19ce5d2b4fe5ec3d4001a357da548c49f50b949f444382945e65d3610e7c","provider_id":"ros2-readonly","provider_operation":"odom.sample","provider_started_at":"2026-09-08T16:11:32.414502Z","release_digest":"sha256:835dd954cfeb3ca311dfa23c2ea18c4472067c640374daf3d5b9d7539d62f554","request_digest":"a22ac67ea0e7abc85235976033847db1bbd92c0c2f325ac612b748b81a249398","result":{"byte_count":1248,"sha256":"sha256:16a44ae56feab9b57128c979ef53310fef5d045d1163d4c230a34a9758e1abd6","status":"SUCCEEDED"},"schema_version":"rolo-targetd-call-receipt/v2","session_id":"n7-r0-20260908T161029Z-7cda2170","status":"SUCCEEDED","target_id":"mentorpi","updated_at":"2026-09-08T16:11:38.219527Z"},"run_id":"n6-formal-r0-20260908T161029Z-48905bd7","schema_version":"rolo-certify-targetd-call-receipt-sidecar/v1","session_id":"n7-r0-20260908T161029Z-7cda2170","suite_digest":"6835c1603dd1397f779916b97c5cb8e3389c7f3f92adbd5422b7b553f0e8da24","suite_id":"landerpi-odom-formal-r0-10"}
