{"case_id":"case-03","idempotency_key":"certify:sha256:1da190b57529eebcb1b7f5804e09d13efc16e3a27458c60774fc795a8c6fccc7","operation_id":"certify:sha256:1da190b57529eebcb1b7f5804e09d13efc16e3a27458c60774fc795a8c6fccc7","receipt":{"artifact_refs":[],"authority_head_digest":"d0a2d9e7f368829c9661b4adf20074ed9f5ff12d267800540a20e9071d92186f","bundle_digest":"e20e8594919a1ce528b96ed3d5890bf1e50a4ace3530be20f052bf6facb26933","context_digest":"sha256:4f087c2527967c2b1128473133adcd3b58e1903e1795db4f27cf6ed18e85a8bb","evidence_refs":[],"fence_epoch":1,"idempotency_key":"certify:sha256:1da190b57529eebcb1b7f5804e09d13efc16e3a27458c60774fc795a8c6fccc7","mapping_confirmation_receipt_digest":"sha256:fb9397a7fa832ae48d4e56150cd957c155110fe4cf1da857300421b959ad65db","provider_fence_digest":"4e810ac33950690a2f94d7f9769f2ec679b428ac4eb13a70f22275086825a4fd","provider_id":"ros2-readonly","provider_operation":"odom.sample","provider_started_at":"2026-09-08T16:11:07.622658Z","release_digest":"sha256:835dd954cfeb3ca311dfa23c2ea18c4472067c640374daf3d5b9d7539d62f554","request_digest":"f323d70b22223366a3b940adcd94bb65e5ae9cf03daf63774e6bafd60e40cb90","result":{"byte_count":1249,"sha256":"sha256:c8660518f10533f4d82e65a77507fc5a781dd731620039408440f2c6ebec5070","status":"SUCCEEDED"},"schema_version":"rolo-targetd-call-receipt/v2","session_id":"n7-r0-20260908T161029Z-7cda2170","status":"SUCCEEDED","target_id":"mentorpi","updated_at":"2026-09-08T16:11:13.540437Z"},"run_id":"n6-formal-r0-20260908T161029Z-48905bd7","schema_version":"rolo-certify-targetd-call-receipt-sidecar/v1","session_id":"n7-r0-20260908T161029Z-7cda2170","suite_digest":"6835c1603dd1397f779916b97c5cb8e3389c7f3f92adbd5422b7b553f0e8da24","suite_id":"landerpi-odom-formal-r0-10"}
