{"case_id":"case-08","idempotency_key":"certify:sha256:7dcca115be4a238a7e524fbaa6f6da7e63d64b4246d1eb424e0db2570331d157","operation_id":"certify:sha256:7dcca115be4a238a7e524fbaa6f6da7e63d64b4246d1eb424e0db2570331d157","receipt":{"artifact_refs":[],"authority_head_digest":"d0a2d9e7f368829c9661b4adf20074ed9f5ff12d267800540a20e9071d92186f","bundle_digest":"e20e8594919a1ce528b96ed3d5890bf1e50a4ace3530be20f052bf6facb26933","context_digest":"sha256:4f087c2527967c2b1128473133adcd3b58e1903e1795db4f27cf6ed18e85a8bb","evidence_refs":[],"fence_epoch":1,"idempotency_key":"certify:sha256:7dcca115be4a238a7e524fbaa6f6da7e63d64b4246d1eb424e0db2570331d157","mapping_confirmation_receipt_digest":"sha256:fb9397a7fa832ae48d4e56150cd957c155110fe4cf1da857300421b959ad65db","provider_fence_digest":"4b066b96ffc94cd4475b27bd963d47811c79ebeb1a774d18ae9eaf99f63a9af6","provider_id":"ros2-readonly","provider_operation":"odom.sample","provider_started_at":"2026-09-08T16:11:38.279488Z","release_digest":"sha256:835dd954cfeb3ca311dfa23c2ea18c4472067c640374daf3d5b9d7539d62f554","request_digest":"d41ffd697a3f88eb5649cd6d1767f62f9dafcfdd2df11a6079411ddd63d3ca28","result":{"byte_count":1245,"sha256":"sha256:3b5a09b070dfbf2364394888c51f072975ba81b61e1ef656c324f41d67917bfe","status":"SUCCEEDED"},"schema_version":"rolo-targetd-call-receipt/v2","session_id":"n7-r0-20260908T161029Z-7cda2170","status":"SUCCEEDED","target_id":"mentorpi","updated_at":"2026-09-08T16:11:44.003943Z"},"run_id":"n6-formal-r0-20260908T161029Z-48905bd7","schema_version":"rolo-certify-targetd-call-receipt-sidecar/v1","session_id":"n7-r0-20260908T161029Z-7cda2170","suite_digest":"6835c1603dd1397f779916b97c5cb8e3389c7f3f92adbd5422b7b553f0e8da24","suite_id":"landerpi-odom-formal-r0-10"}
