{"case_id":"case-09","idempotency_key":"certify:sha256:bbbba66e96b531cfdcf5dd2b31172c08e508306bd9e5bef1fc6f791214332508","operation_id":"certify:sha256:bbbba66e96b531cfdcf5dd2b31172c08e508306bd9e5bef1fc6f791214332508","receipt":{"artifact_refs":[],"authority_head_digest":"d0a2d9e7f368829c9661b4adf20074ed9f5ff12d267800540a20e9071d92186f","bundle_digest":"e20e8594919a1ce528b96ed3d5890bf1e50a4ace3530be20f052bf6facb26933","context_digest":"sha256:4f087c2527967c2b1128473133adcd3b58e1903e1795db4f27cf6ed18e85a8bb","evidence_refs":[],"fence_epoch":1,"idempotency_key":"certify:sha256:bbbba66e96b531cfdcf5dd2b31172c08e508306bd9e5bef1fc6f791214332508","mapping_confirmation_receipt_digest":"sha256:fb9397a7fa832ae48d4e56150cd957c155110fe4cf1da857300421b959ad65db","provider_fence_digest":"e10971100cf1c01a8c288b171e97d767c1226ce10304ca3855e45f80baa58161","provider_id":"ros2-readonly","provider_operation":"odom.sample","provider_started_at":"2026-09-08T16:11:44.059197Z","release_digest":"sha256:835dd954cfeb3ca311dfa23c2ea18c4472067c640374daf3d5b9d7539d62f554","request_digest":"fb18ddd665084535e122fe115436dcefa15269ad142eacee54f98aacf8ec831a","result":{"byte_count":1252,"sha256":"sha256:8b2214f63d3903003385cf5a45251231e01adaa796d579d40d3af96666f51bd6","status":"SUCCEEDED"},"schema_version":"rolo-targetd-call-receipt/v2","session_id":"n7-r0-20260908T161029Z-7cda2170","status":"SUCCEEDED","target_id":"mentorpi","updated_at":"2026-09-08T16:11:49.980439Z"},"run_id":"n6-formal-r0-20260908T161029Z-48905bd7","schema_version":"rolo-certify-targetd-call-receipt-sidecar/v1","session_id":"n7-r0-20260908T161029Z-7cda2170","suite_digest":"6835c1603dd1397f779916b97c5cb8e3389c7f3f92adbd5422b7b553f0e8da24","suite_id":"landerpi-odom-formal-r0-10"}
